<?xml version="1.0" encoding="UTF-8"?>
<listaValutazioni xmlns:xsi="http://www.w3.org/2001/XMLSchema-instance" xsi:noNamespaceSchemaLocation="Valutazioni.xsd">
  <valutazione>
    <idOggettoValutato>R3</idOggettoValutato>
    <codFisc>CPZGLC90P11H501W</codFisc>
    <votoUtilita>0</votoUtilita>
    <votoAccordo>3</votoAccordo>
  </valutazione>
  <valutazione>
    <idOggettoValutato>CM2-CMR1</idOggettoValutato>
    <codFisc>CPZGLC90P11H501W</codFisc>
    <votoUtilita>5</votoUtilita>
    <votoAccordo>0</votoAccordo>
  </valutazione>
  <valutazione>
    <idOggettoValutato>CM2</idOggettoValutato>
    <codFisc>CPZGLC90P11H501W</codFisc>
    <votoUtilita>0</votoUtilita>
    <votoAccordo>3</votoAccordo>
  </valutazione>
  <valutazione>
    <idOggettoValutato>R1</idOggettoValutato>
    <codFisc>CPZGLC90P11H501W</codFisc>
    <votoUtilita>3</votoUtilita>
    <votoAccordo>3</votoAccordo>
  </valutazione>
  <valutazione>
    <idOggettoValutato>R3</idOggettoValutato>
    <codFisc>RSSGNN64R03E472G</codFisc>
    <votoUtilita>0</votoUtilita>
    <votoAccordo>3</votoAccordo>
  </valutazione>
  <valutazione>
    <idOggettoValutato>R2</idOggettoValutato>
    <codFisc>RSSGNN64R03E472G</codFisc>
    <votoUtilita>5</votoUtilita>
    <votoAccordo>0</votoAccordo>
  </valutazione>
  <valutazione>
    <idOggettoValutato>CM2</idOggettoValutato>
    <codFisc>RSSGNN64R03E472G</codFisc>
    <votoUtilita>0</votoUtilita>
    <votoAccordo>3</votoAccordo>
  </valutazione>
</listaValutazioni>
